{
  "$schema": "https://json-schema.org/draft/2020-12/schema",
  "$id": "https://nightglow.invalid/schemas/v1/physics-data-manifest.schema.json",
  "title": "PhysicsDataManifest fixture v1",
  "type": "object",
  "additionalProperties": false,
  "required": ["physics_data_manifest_schema_revision", "physics_data_manifest_id", "physics_model_revision", "response_basis_revision", "surface_terrain_product_id", "reference_directional_intensity_w_sr", "reference_surface_pressure_pa", "surface_extinction_per_m_at_reference_pressure", "scale_height_m", "path_length_m", "shape", "response_basis_linear_rgb"],
  "properties": {
    "physics_data_manifest_schema_revision": {"const": "physics-data-manifest-fixture-v1"},
    "physics_data_manifest_id": {"type": "string", "minLength": 1},
    "physics_model_revision": {"type": "string", "minLength": 1},
    "response_basis_revision": {"type": "string", "minLength": 1},
    "surface_terrain_product_id": {"type": "string", "minLength": 1},
    "reference_directional_intensity_w_sr": {"type": "number", "exclusiveMinimum": 0},
    "reference_surface_pressure_pa": {"type": "number", "exclusiveMinimum": 0},
    "surface_extinction_per_m_at_reference_pressure": {"type": "number", "minimum": 0},
    "scale_height_m": {"type": "number", "exclusiveMinimum": 0},
    "path_length_m": {"type": "number", "exclusiveMinimum": 0},
    "shape": {"type": "array", "prefixItems": [{"type": "integer", "minimum": 1}, {"type": "integer", "minimum": 1}, {"const": 3}], "items": false},
    "response_basis_linear_rgb": {"type": "array", "minItems": 1, "items": {"type": "number", "minimum": 0}}
  }
}
