{
  "physics_data_manifest_schema_revision": "physics-data-manifest-fixture-v1",
  "physics_data_manifest_id": "physics-data:fixture:v1",
  "physics_model_revision": "fixture-single-scatter-scalar-v1",
  "response_basis_revision": "fixture-reference-response-v1",
  "surface_terrain_product_id": "surface-terrain:fixture-flat-lambertian:v1",
  "reference_directional_intensity_w_sr": 70,
  "reference_surface_pressure_pa": 99850,
  "surface_extinction_per_m_at_reference_pressure": 0.00012,
  "scale_height_m": 8000,
  "path_length_m": 60000,
  "shape": [2, 4, 3],
  "response_basis_linear_rgb": [
    0.000001, 0.0000008, 0.0000005,
    0.0000012, 0.0000009, 0.00000055,
    0.0000014, 0.000001, 0.0000006,
    0.0000011, 0.00000085, 0.00000052,
    0.0000003, 0.00000035, 0.0000004,
    0.00000032, 0.00000037, 0.00000042,
    0.00000034, 0.00000039, 0.00000044,
    0.00000031, 0.00000036, 0.00000041
  ]
}
